<?xml version="1.0" encoding="UTF-8"?>
<xs:schema xmlns:xs="http://www.w3.org/2001/XMLSchema" elementFormDefault="qualified">
    <xs:element name="OSReference">
        <xs:complexType>
            <xs:sequence>
                <xs:element name="Description" type="xs:string"/>
                <xs:element name="OSVersions">
                    <xs:complexType>
                        <xs:sequence>
                            <xs:element maxOccurs="unbounded" name="OSversion">
                                <xs:complexType>
                                    <xs:attribute name="name" type="xs:string"/>
                                </xs:complexType>
                            </xs:element>
                        </xs:sequence>
                        <xs:attribute name="mode" type="xs:string"/>

                    </xs:complexType>
                </xs:element>
                <xs:element name="CommandList">
                    <xs:complexType>
                        <xs:sequence>
                            <xs:element maxOccurs="unbounded" name="Command">
                                <xs:complexType>
                                    <xs:sequence>
                                        <xs:element maxOccurs="unbounded" name="Syntax">
                                            <xs:complexType>
                                                <xs:simpleContent>
                                                  <xs:extension base="xs:string">
                                                  <xs:attribute name="version" type="xs:string"/>
                                                  </xs:extension>
                                                </xs:simpleContent>
                                            </xs:complexType>
                                        </xs:element>
                                    </xs:sequence>
                                    <xs:attribute name="name" type="xs:string"/>
                                    <xs:attribute name="type" type="xs:string"/>
                                    <xs:attribute name="mode" type="xs:string"/>
                                    <xs:attribute name="negated" type="xs:string"/>
                                </xs:complexType>
                            </xs:element>
                        </xs:sequence>
                    </xs:complexType>
                </xs:element>
            </xs:sequence>
            <xs:attribute name="name" type="xs:string"/>
        </xs:complexType>
    </xs:element>
</xs:schema>
